### ISSUE TITLE
Wrong remote IP address

### ISSUE THREAD

**Issue by truedays** [flashmob/go-guerrilla#48]
Hello,

In mysql i'm logging all the same IP addresses. Upon further investigation, I see the wrong remote_address being shown in console (verbose) output as well.

It appears the first received email (expected test emails from my web server) remote address is used for all subsequent incoming mail.
 
Here's my evidence/findings so far.. (addresses obfuscated) 

Console output:
```DEBU[14028] [0.0.0.0:25] Waiting for a new client. Next Client ID: 3 
INFO[14028] Handle client [<myWebServer>:50219], id: 2    
DEBU[14028] Writing response to client: 
220 mx.mydomain.com SMTP Guerrilla(1.5.1-30-g44d8a9d) #2 (1) 2017-01-21T09:56:12-05:00 gr:9
 
DEBU[14028] Client sent: HELO localhost                  
DEBU[14028] Writing response to client: 
250 mx.mydomain.com Hello
 
DEBU[14028] Client sent: MAIL FROM: <cutie@1688.com>     
DEBU[14028] Writing response to client: 
250 OK
        
DEBU[14028] Client sent: RCPT TO: <mydomain@mydomain.com> 
DEBU[14028] Writing response to client: 
250 OK
        
DEBU[14029] Client sent: DATA                            
DEBU[14029] Writing response to client: 
354 Enter message, ending with '.' on a line by itself
 
DEBU[14029] Email saved c769dd047cbc18eb3eb754d22c5bcb3a (len=20080) 
DEBU[14029] Writing response to client: 
250 OK : queued as c769dd047cbc18eb3eb754d22c5bcb3a
 
DEBU[14029] Client sent: QUIT                            
DEBU[14029] Writing response to client: 
221 Bye
```

And that mail is recorded in MySQL as coming from ***MY** Web server* IP:
```MariaDB [gmail]> select date,ip_addr from new_mail;
+---------------------+-----------------+
| date                | ip_addr         |
+---------------------+-----------------+
| 2017-01-20 18:20:53 | <myWebServer>:52 |
| 2017-01-20 18:40:50 | <myWebServer>:58 |
| 2017-01-21 01:34:31 | <myWebServer>:58 |
| 2017-01-21 01:43:22 | <myWebServer>:58 |
| 2017-01-21 01:46:22 | <myWebServer>:58 |
| 2017-01-21 04:44:12 | <myWebServer>:58 |
| 2017-01-21 06:01:08 | <myWebServer>:58 |
| 2017-01-21 06:03:09 | <myWebServer>:50 |
| 2017-01-21 09:56:13 | <myWebServer>:50 | 
+---------------------+-----------------+
9 rows in set (0.00 sec)
```

But myWebServer never sent an email at 09:56:13 and a tcpdump on myGuerrillaMail server proves this:

```
09:56:12.187568 IP 95.47.x.x.57927 > <myGuerrillaMailServer>.25: Flags [S], seq 3530872155, win 14600, options [mss 1460,sackOK,TS val 13352891 ecr 0,nop,wscale 7], length 0
09:56:12.187610 IP <myGuerrillaMailServer>.25 > 95.47.x.x.57927: Flags [S.], seq 1217573791, ack 3530872156, win 14480, options [mss 1460,sackOK,TS val 2926659315 ecr 13352891,nop,wscale 7],
 length 0
09:56:12.332680 IP 95.47.x.x.57927 > <myGuerrillaMailServer>.25: Flags [.], ack 1, win 115, options [nop,nop,TS val 13352927 ecr 2926659315], length 0
09:56:12.333016 IP <myGuerrillaMailServer>.25 > 95.47.x.x.57927: Flags [P.], seq 1:96, ack 1, win 114, options [nop,nop,TS val 2926659461 ecr 13352927], length 95
09:56:12.477180 IP 95.47.x.x.57927 > <myGuerrillaMailServer>.25: Flags [.], ack 96, win 115, options [nop,nop,TS val 13352964 ecr 2926659461], length 0
09:56:12.496068 IP 95.47.x.x.57927 > <myGuerrillaMailServer>.25: Flags [P.], seq 1:17, ack 96, win 115, options [nop,nop,TS val 13352968 ecr 2926659461], length 16
09:56:12.496083 IP <myGuerrillaMailServer>.25 > 95.47.x.x.57927: Flags [.], ack 17, win 114, options [nop,nop,TS val 2926659624 ecr 13352968], length 0
09:56:12.496227 IP <myGuerrillaMailServer>.25 > 95.47.x.x.57927: Flags [P.], seq 96:125, ack 17, win 114, options [nop,nop,TS val 2926659624 ecr 13352968], length 29
09:56:12.663587 IP 95.47.x.x.57927 > <myGuerrillaMailServer>.25: Flags [P.], seq 17:46, ack 125, win 115, options [nop,nop,TS val 13353010 ecr 2926659624], length 29
09:56:12.663781 IP <myGuerrillaMailServer>.25 > 95.47.x.x.57927: Flags [P.], seq 125:133, ack 46, win 114, options [nop,nop,TS val 2926659792 ecr 13353010], length 8
09:56:12.834716 IP 95.47.x.x.57927 > <myGuerrillaMailServer>.25: Flags [P.], seq 46:84, ack 133, win 115, options [nop,nop,TS val 13353053 ecr 2926659792], length 38
09:56:12.834911 IP <myGuerrillaMailServer>.25 > 95.47.x.x.57927: Flags [P.], seq 133:141, ack 84, win 114, options [nop,nop,TS val 2926659962 ecr 13353053], length 8
09:56:12.992272 IP 95.47.x.x.57927 > <myGuerrillaMailServer>.25: Flags [P.], seq 84:90, ack 141, win 115, options [nop,nop,TS val 13353092 ecr 2926659962], length 6
09:56:12.992404 IP <myGuerrillaMailServer>.25 > 95.47.x.x.57927: Flags [P.], seq 141:197, ack 90, win 114, options [nop,nop,TS val 2926660120 ecr 13353092], length 56
09:56:13.150204 IP 95.47.x.x.57927 > <myGuerrillaMailServer>.25: Flags [.], seq 90:1538, ack 197, win 115, options [nop,nop,TS val 13353132 ecr 2926660120], length 1448
09:56:13.150213 IP 95.47.x.x.57927 > <myGuerrillaMailServer>.25: Flags [.], seq 1538:2986, ack 197, win 115, options [nop,nop,TS val 13353132 ecr 2926660120], length 1448
09:56:13.150238 IP <myGuerrillaMailServer>.25 > 95.47.x.x.57927: Flags [.], ack 2986, win 159, options [nop,nop,TS val 2926660278 ecr 13353132], length 0
09:56:13.150254 IP 95.47.x.x.57927 > <myGuerrillaMailServer>.25: Flags [.], seq 2986:4434, ack 197, win 115, options [nop,nop,TS val 13353132 ecr 2926660120], length 1448
09:56:13.150261 IP 95.47.x.x.57927 > <myGuerrillaMailServer>.25: Flags [.], seq 4434:5882, ack 197, win 115, options [nop,nop,TS val 13353132 ecr 2926660120], length 1448
09:56:13.150282 IP <myGuerrillaMailServer>.25 > 95.47.x.x.57927: Flags [.], ack 5882, win 204, options [nop,nop,TS val 2926660278 ecr 13353132], length 0
09:56:13.150268 IP 95.47.x.x.57927 > <myGuerrillaMailServer>.25: Flags [.], seq 5882:7330, ack 197, win 115, options [nop,nop,TS val 13353132 ecr 2926660120], length 1448
09:56:13.150297 IP 95.47.x.x.57927 > <myGuerrillaMailServer>.25: Flags [.], seq 7330:8778, ack 197, win 115, options [nop,nop,TS val 13353132 ecr 2926660120], length 1448
09:56:13.150302 IP <myGuerrillaMailServer>.25 > 95.47.x.x.57927: Flags [.], ack 8778, win 249, options [nop,nop,TS val 2926660278 ecr 13353132], length 0
09:56:13.150358 IP 95.47.x.x.57927 > <myGuerrillaMailServer>.25: Flags [.], seq 8778:10226, ack 197, win 115, options [nop,nop,TS val 13353132 ecr 2926660120], length 1448
09:56:13.150365 IP 95.47.x.x.57927 > <myGuerrillaMailServer>.25: Flags [.], seq 10226:11674, ack 197, win 115, options [nop,nop,TS val 13353132 ecr 2926660120], length 1448
09:56:13.150380 IP <myGuerrillaMailServer>.25 > 95.47.x.x.57927: Flags [.], ack 11674, win 295, options [nop,nop,TS val 2926660278 ecr 13353132], length 0
09:56:13.150372 IP 95.47.x.x.57927 > <myGuerrillaMailServer>.25: Flags [.], seq 11674:13122, ack 197, win 115, options [nop,nop,TS val 13353132 ecr 2926660120], length 1448
09:56:13.150422 IP 95.47.x.x.57927 > <myGuerrillaMailServer>.25: Flags [P.], seq 13122:14570, ack 197, win 115, options [nop,nop,TS val 13353132 ecr 2926660120], length 1448
09:56:13.150427 IP <myGuerrillaMailServer>.25 > 95.47.x.x.57927: Flags [.], ack 14570, win 340, options [nop,nop,TS val 2926660278 ecr 13353132], length 0
09:56:13.294485 IP 95.47.x.x.57927 > <myGuerrillaMailServer>.25: Flags [.], seq 14570:16018, ack 197, win 115, options [nop,nop,TS val 13353168 ecr 2926660278], length 1448
09:56:13.294494 IP 95.47.x.x.57927 > <myGuerrillaMailServer>.25: Flags [.], seq 16018:17466, ack 197, win 115, options [nop,nop,TS val 13353168 ecr 2926660278], length 1448
09:56:13.294526 IP <myGuerrillaMailServer>.25 > 95.47.x.x.57927: Flags [.], ack 17466, win 385, options [nop,nop,TS val 2926660422 ecr 13353168], length 0
09:56:13.294552 IP 95.47.x.x.57927 > <myGuerrillaMailServer>.25: Flags [.], seq 17466:18914, ack 197, win 115, options [nop,nop,TS val 13353168 ecr 2926660278], length 1448
09:56:13.294563 IP 95.47.x.x.57927 > <myGuerrillaMailServer>.25: Flags [.], seq 18914:20362, ack 197, win 115, options [nop,nop,TS val 13353168 ecr 2926660278], length 1448
09:56:13.294585 IP <myGuerrillaMailServer>.25 > 95.47.x.x.57927: Flags [.], ack 20362, win 430, options [nop,nop,TS val 2926660422 ecr 13353168], length 0
09:56:13.294571 IP 95.47.x.x.57927 > <myGuerrillaMailServer>.25: Flags [P.], seq 20362:20448, ack 197, win 115, options [nop,nop,TS val 13353168 ecr 2926660278], length 86
09:56:13.333669 IP <myGuerrillaMailServer>.25 > 95.47.x.x.57927: Flags [.], ack 20448, win 430, options [nop,nop,TS val 2926660462 ecr 13353168], length 0
09:56:13.362872 IP <myGuerrillaMailServer>.25 > 95.47.x.x.57927: Flags [P.], seq 197:250, ack 20448, win 430, options [nop,nop,TS val 2926660491 ecr 13353168], length 53
09:56:13.527752 IP 95.47.x.x.57927 > <myGuerrillaMailServer>.25: Flags [P.], seq 20448:20454, ack 250, win 115, options [nop,nop,TS val 13353226 ecr 2926660491], length 6
09:56:13.527774 IP <myGuerrillaMailServer>.25 > 95.47.x.x.57927: Flags [.], ack 20454, win 430, options [nop,nop,TS val 2926660655 ecr 13353226], length 0
09:56:13.527943 IP <myGuerrillaMailServer>.25 > 95.47.x.x.57927: Flags [P.], seq 250:259, ack 20454, win 430, options [nop,nop,TS val 2926660655 ecr 13353226], length 9
09:56:13.527985 IP <myGuerrillaMailServer>.25 > 95.47.x.x.57927: Flags [F.], seq 259, ack 20454, win 430, options [nop,nop,TS val 2926660656 ecr 13353226], length 0
09:56:13.674598 IP 95.47.x.x.57927 > <myGuerrillaMailServer>.25: Flags [F.], seq 20454, ack 260, win 115, options [nop,nop,TS val 13353263 ecr 2926660655], length 0
09:56:13.674622 IP <myGuerrillaMailServer>.25 > 95.47.x.x.57927: Flags [.], ack 20455, win 430, options [nop,nop,TS val 2926660802 ecr 13353263], length 0
```

The IP address 95.47.x.x is the remote address I'm expecting to see/log.

**Comment by flashmob** [comment]
Thanks for the detail bug report, it's very helpful.
Indeed, it looks like when the Client is recycled from the pool, the init() func forgot to set the new remote address.

In the client.go file at the end of init(), please add the following line:

c.RemoteAddress = conn.RemoteAddr().String()

Hopefully that should work. If it does, please submit a PR and we'll merge it in.
